{
  "id": "example",
  "name": "Example Scanner",
  "version": "1.0.0",
  "capabilities": {
    "categories": ["custom"],
    "outputFormats": ["json"],
    "supportsScreenshots": false,
    "supportsConcurrency": true,
    "requiresBrowser": false
  },
  "entry": {
    "module": "./index.js"
  }
}
